Name,Price,Link,Image
Computer 1201+1 Head Embroidery Machine Sequin Cording Embroidery Machine for Sale,"$1,800.00-6,000.00",https://www.alibaba.com/product-detail/Computer-1201-1-Head-Embroidery-Machine_1601357939260.html,https://s.alicdn.com/@sc04/kf/He92ce348bf124b13ad29e05ce1949aecC/Computer-1201-1-Head-Embroidery-Machine-Sequin.jpg_480x480.jpg?hasNWGrade=1
Multi Function Flat Embroidery Machine 1201+1 Sequin Embroidery Computer Machine,"$1,800.00-6,000.00",https://www.alibaba.com/product-detail/Multi-Function-Flat-Embroidery-Machine-1201_1601357859691.html,https://s.alicdn.com/@sc04/kf/H072a6307f91e4c34bd413a38b91e8253K/Multi-Function-Flat-Embroidery-Machine-1201-1.jpg_480x480.jpg?hasNWGrade=1
Hot Selling Embroidery Machine Manufacturers Single Head Sequin Cording Embroidery Machine With Computer,"$1,800.00-6,000.00",https://www.alibaba.com/product-detail/Hot-Selling-Embroidery-Machine-Manufacturers-Single_1601288138463.html,https://s.alicdn.com/@sc04/kf/H85c668789dff4113ad86f792634da866w/Hot-Selling-Embroidery-Machine-Manufacturers-Single-Head.jpg_480x480.jpg?hasNWGrade=1
Single Head Flat Embroidery Machine Computer Embroidery Machine With Sequin Device,"$1,800.00-6,000.00",https://www.alibaba.com/product-detail/Single-Head-Flat-Embroidery-Machine-Computer_1601288275333.html,https://s.alicdn.com/@sc04/kf/Ha947ef20d7634c9fb8f5a1ae98409b81w/Single-Head-Flat-Embroidery-Machine-Computer-Embroidery.jpg_480x480.jpg?hasNWGrade=1
Computer 1201+1 Beads Cording Embroidery Machine Flat Embroidery Machine With Sequin Function Embroidery,"$1,800.00-6,000.00",https://www.alibaba.com/product-detail/Computer-1201-1-Beads-Cording-Embroidery_1601288024324.html,https://s.alicdn.com/@sc04/kf/H2f99fe9afdbb49349a1b7ad57e11acbbF/Computer-1201-1-Beads-Cording-Embroidery-Machine.jpg_480x480.jpg?hasNWGrade=1
Computer Sequin Embroidery Machine 1 Head High Speed Flat Embroidery Machine With Sequin Cording Device,"$1,800.00-6,000.00",https://www.alibaba.com/product-detail/Computer-Sequin-Embroidery-Machine-1-Head_1601288261032.html,https://s.alicdn.com/@sc04/kf/H65287177d88b415fa293d490ba4818fef/Computer-Sequin-Embroidery-Machine-1-Head-High.jpg_480x480.jpg?hasNWGrade=1
Hot Selling Embroidery Machine Manufacturers Single Head Sequin Cording Embroidery Machine With Computer,"$1,800.00-6,000.00",https://www.alibaba.com/product-detail/Hot-Selling-Embroidery-Machine-Manufacturers-Single_1601272302135.html,https://s.alicdn.com/@sc04/kf/Hffed8b9f2c1b4bd6b10849d50a9221ba8/Hot-Selling-Embroidery-Machine-Manufacturers-Single-Head.jpg_480x480.jpg?hasNWGrade=1
Wholesale Multi Function Flat Embroidery Machine Computer Embroidery Machine With Sequin Embroidery Device,"$1,800.00-6,000.00",https://www.alibaba.com/product-detail/Wholesale-Multi-Function-Flat-Embroidery-Machine_1601272285032.html,https://s.alicdn.com/@sc04/kf/H515642df25ce4be7a70c2daee588954c5/Wholesale-Multi-Function-Flat-Embroidery-Machine-Computer.jpg_480x480.jpg?hasNWGrade=1
New Design Single Head 1201+1 Sequin Embroidery Machine Computerized Sequin Mix Embroidery Machine,"$1,800.00-6,000.00",https://www.alibaba.com/product-detail/New-Design-Single-Head-1201-1_1601271595604.html,https://s.alicdn.com/@sc04/kf/H37e81a24f251452cbfefb8d22bc35d436/New-Design-Single-Head-1201-1-Sequin.jpg_480x480.jpg?hasNWGrade=1
Wholesale Cording and Sequin Computerized Embroidery Machine Multifunction Sequin Embroidery Machine,"$1,800.00-6,000.00",https://www.alibaba.com/product-detail/Wholesale-Cording-and-Sequin-Computerized-Embroidery_1600882951626.html,https://s.alicdn.com/@sc04/kf/Hd146fef7791e4c6a99f39be4262a0ecaP/Wholesale-Cording-and-Sequin-Computerized-Embroidery-Machine.jpg_480x480.jpg?hasNWGrade=1
Sequin Mixed Computerized Embroidery Machine,"$1,800.00-6,000.00",https://www.alibaba.com/product-detail/Sequin-Mixed-Computerized-Embroidery-Machine_51063301.html,https://s.alicdn.com/@sc04/kf/H06f6fc3b92b3479e9e51730adef0ac4bt/Sequin-Mixed-Computerized-Embroidery-Machine.jpg?hasNWGrade=1
Simple Cording and Sequin Computerized Embroidery Machine,"$1,800.00-6,000.00",https://www.alibaba.com/product-detail/Simple-Cording-and-Sequin-Computerized-Embroidery_62419176510.html,https://s.alicdn.com/@sc04/kf/H55fb289d8f0a4d5ab47a2c536e5eaeecc/Simple-Cording-and-Sequin-Computerized-Embroidery-Machine.jpg?hasNWGrade=1
Good Price Single Heads Sequin Computerized Embroidery Machine,"$1,800.00-6,000.00",https://www.alibaba.com/product-detail/Good-Price-Single-Heads-Sequin-Computerized_62389253133.html,https://s.alicdn.com/@sc04/kf/H83794f5ec06b47b2a961eb9e6cf57029t/Good-Price-Single-Heads-Sequin-Computerized-Embroidery.jpg?hasNWGrade=1